title,description,url,publishedAt,source,type,content,sentiment,sentiment_score
why investors are on tenterhooks for nvidias latest earnings report,the us chip giant is considered a bellwether for both the ai industry and wall street.,https://www.aljazeera.com/news/2025/8/27/why-investors-are-on-tenterhooks-for-nvidias-latest-earnings-report,2025-08-27 07:31:20,Al Jazeera English,news,"chip giant nvidia is set to release its latest earnings report and the results could move the entire us stock market. over the past two years, the chipmaker has risen to become the worlds most valua 5658 chars",positive,0.776272177696228
yanko designs best of ifa 2025 effortless intelligence and designdriven innovation,"yanko designs best of ifa 2025 effortless intelligence and designdriven innovationthe best technology has always been invisible, working quietly in the background to make life better without demanding constant attention or complicated setup procedures. ifa",https://www.yankodesign.com/2025/09/07/yanko-designs-best-of-ifa-2025-effortless-intelligence-and-design-driven-innovation/,2025-09-07 11:40:05,Yanko Design,news,"the best technology has always been invisible, working quietly in the background to make life better without demanding constant attention or complicated setup procedures. ifa 2025 showcased a new gen 52712 chars",neutral,0.0
anthropic launches ai advisory council to boost ties with washington,ai company launches council to strengthen washington ties as ai takes on critical defence and policy roles.,https://www.aljazeera.com/economy/2025/8/27/anthropic-launches-ai-advisory-council-to-boost-ties-with-washington,2025-08-27 16:52:32,Al Jazeera English,news,the artificial intelligence company anthropic launched a national security and public sector advisory council in efforts to deepen ties with washington and allied governments as ai becomes increasing 1925 chars,positive,0.8302656412124634
hisense 116ux rgb miniled tv becomes first consumer display with dolby vision 2 technology,"hisense 116ux rgb miniled tv becomes first consumer display with dolby vision 2 technologyliving rooms have long suffered from a persistent problem dark movie scenes that leave viewers squinting at murky shadows, adjusting brightness settings, and missing c",https://www.yankodesign.com/2025/09/03/hisense-116ux-rgb-mini-led-tv-becomes-first-consumer-display-with-dolby-vision-2-technology/,2025-09-03 17:20:24,Yanko Design,news,"living rooms have long suffered from a persistent problem dark movie scenes that leave viewers squinting at murky shadows, adjusting brightness settings, and missing crucial visual details. even pre 8588 chars",negative,-0.9570801258087158
new ai apps help rental drivers avoid fake damage fees,rental car drivers use aipowered apps like proofr to protect themselves from unfair damage fees as major companies deploy automated inspection tools.,https://www.foxnews.com/tech/new-ai-apps-help-rental-drivers-avoid-fake-damage-fees,2025-09-06 16:33:44,Fox News,news,"rental car drivers are now turning to artificial intelligence to protect themselves from surprise damage fees. major companies, such as hertz and sixt, have begun using automated inspection tools to 5753 chars",neutral,0.0
"ai and the future of work evolution, not extinction",few technological shifts have generated as much excitement and anxiety as the introduction of artificial intelligence in the workplace.,https://www.techradar.com/pro/ai-and-the-future-of-work-evolution-not-extinction,2025-08-22 05:51:29,TechRadar,news,few technological shifts have generated as much excitement and anxiety as the introduction of artificial intelligence in the workplace. were seeing a marked step forward in the innovation and wider 5206 chars,neutral,0.0
remote jobs are hard to get. workers who did share tips for finding one,"when kate smith worked a 9to5 office job, she was burnedout, suffering from daily migraines and thinking, i cant do this for the rest of my life. for ...",https://www.yahoo.com/lifestyle/articles/remote-jobs-hard-workers-did-132638700.html,2025-09-04 13:26:38,Yahoo Entertainment,news,"new york ap when kate smith worked a 9to5 office job, she was burnedout, suffering from daily migraines and thinking, i cant do this for the rest of my life. she didnt have to. for her next r 7194 chars",negative,-0.6409323811531067
four talks and events hosted by dezeen during london design festival 2025,"during this years london design festival, dezeen is cohosting a series of events, including talks with ustwo, programa and morrama, and a cocktail party with henge. visitors must rsvp to ensure attendance, as spaces are limited and allocated on a firstcome",https://www.dezeen.com/2025/09/11/dezeen-events-london-design-festival-2025/,2025-09-11 15:00:27,Dezeen,news,"during this years london design festival, dezeen is cohosting a series of events, including talks with ustwo, programa and morrama, and a cocktail party with henge. visitors must rsvp to ensure at 2579 chars",neutral,0.0
mckinsey technology trends outlook 2025,which new technology will have the most impact in 2025 and beyond? our annual analysis ranks the top tech trends that matter most for...,https://www.mckinsey.com/capabilities/mckinsey-digital/our-insights/the-top-trends-in-tech,2025-07-22 00:00:00,McKinsey & Company,news,which new technology will have the most impact in 2025 and beyond? our annual analysis ranks the top tech trends that matter most for...,neutral,0.0
the 2025 ai index report,"the ai index offers one of the most comprehensive, datadriven views of artificial intelligence. recognized as a trusted resource by global media, governments,...",https://hai.stanford.edu/ai-index/2025-ai-index-report,2025-04-06 00:00:00,Stanford HAI,news,"the ai index offers one of the most comprehensive, datadriven views of artificial intelligence. recognized as a trusted resource by global media, governments,...",neutral,0.0
5.26 tn artificial intelligence ai market trends and,"the global artificial intelligence market is projected to surge from usd 273.6 billion in 2023 to usd 5.26 trillion by 2035, at a cagr of...",https://www.globenewswire.com/news-release/2025/06/16/3099615/0/en/5-26-Tn-Artificial-Intelligence-AI-Market-Trends-and-Global-Forecasts-to-2035-BFSI-Sector-Leads-as-AI-Revolutionizes-Financial-Services-Healthcare-on-the-Rise.html,2025-06-16 00:00:00,GlobeNewswire,news,"the global artificial intelligence market is projected to surge from usd 273.6 billion in 2023 to usd 5.26 trillion by 2035, at a cagr of...",positive,0.9182451963424683
"artificial intelligence market outlook 2025 strategy, growth forecast enterprise opportunity","explore the 2025 artificial intelligence market size, growth forecast, use cases, vendor analysis ai trends across industries.",https://www.marketsandmarkets.com/blog/ICT/artificial-intelligence-market,2025-05-27 00:00:00,MarketsandMarkets,news,"explore the 2025 artificial intelligence market size, growth forecast, use cases, vendor analysis ai trends across industries.",neutral,0.0
"maritime artificial intelligence market industry report, 2030",the global maritime artificial intelligence market size was estimated at usd 4321.1 million in 2024 and is projected to grow at a cagr of 40.6 from 2025 to...,https://www.grandviewresearch.com/industry-analysis/maritime-artificial-intelligence-market-report,2025-05-07 00:00:00,Grand View Research,news,the global maritime artificial intelligence market size was estimated at usd 4321.1 million in 2024 and is projected to grow at a cagr of 40.6 from 2025 to...,neutral,0.0
"ai in tourism market size share industry report, 2030","ai in tourism market size, share trends analysis report by offering solution, services, by end use transportation mobility services,...",https://www.grandviewresearch.com/industry-analysis/artificial-intelligence-ai-tourism-market-report,2025-04-10 00:00:00,Grand View Research,news,"ai in tourism market size, share trends analysis report by offering solution, services, by end use transportation mobility services,...",neutral,0.0
"u.s. artificial intelligence in healthcare market report, 2033",the us artificial intelligence in healthcare market size was estimated at usd 13.26 billion in 2024 and is projected to grow at a cagr of 36.76 from 2025 to...,https://www.grandviewresearch.com/industry-analysis/us-artificial-intelligence-healthcare-market-report,2025-06-17 00:00:00,Grand View Research,news,the us artificial intelligence in healthcare market size was estimated at usd 13.26 billion in 2024 and is projected to grow at a cagr of 36.76 from 2025 to...,neutral,0.0
"social business intelligence market industry report, 2033","the global social business intelligence market size was estimated at usd 29327.2 million in 2024 and is projected to reach usd 81051.5 million by 2033,...",https://www.grandviewresearch.com/industry-analysis/social-business-intelligence-market-report,2025-07-08 00:00:00,Grand View Research,news,"the global social business intelligence market size was estimated at usd 29327.2 million in 2024 and is projected to reach usd 81051.5 million by 2033,...",neutral,0.0
"storage area artificial intelligence network market report, 2030",the global storage area artificial intelligence network market size was estimated at usd 16.23 billion in 2024 and is projected to reach usd 60.2 billion by...,https://www.grandviewresearch.com/industry-analysis/storage-area-artificial-intelligence-network-market-report,2025-01-22 00:00:00,Grand View Research,news,the global storage area artificial intelligence network market size was estimated at usd 16.23 billion in 2024 and is projected to reach usd 60.2 billion by...,neutral,0.0
"beauty tech market size and share industry report, 2030","beauty tech market size, share trends analysis report by technology artificial intelligence ai, augmented reality ar, by product category skincare...",https://www.grandviewresearch.com/industry-analysis/beauty-tech-market-report,2025-04-08 00:00:00,Grand View Research,news,"beauty tech market size, share trends analysis report by technology artificial intelligence ai, augmented reality ar, by product category skincare...",neutral,0.0
ai trends in the food and beverage industry,"june 27, 2025 brands are beginning to unlock the full power of artificial intelligence ai, moving from infinite capabilities to concrete applications...",https://www.innovamarketinsights.com/trends/ai-trends-in-the-food-and-beverage-industry/,2025-05-14 00:00:00,Innova Market Insights,news,"june 27, 2025 brands are beginning to unlock the full power of artificial intelligence ai, moving from infinite capabilities to concrete applications...",neutral,0.0
"banking industry trends how digitization, data, and ai are redefining the us banking landscape","advanced capabilities in digitization, data analytics, automation, and artificial intelligence have a profound impact on us banks and the entire financial...",https://www.morningstar.com/stocks/banking-industry-trends-how-digitization-data-ai-are-redefining-us-banking-landscape,2025-06-12 00:00:00,Morningstar,news,"advanced capabilities in digitization, data analytics, automation, and artificial intelligence have a profound impact on us banks and the entire financial...",neutral,0.0
visual intelligence market size share industry report 2030,the global visual intelligence market size was estimated at usd 11432.0 million in 2024 and is projected to grow at a cagr of 19.1 from 2025 to 2030.,https://www.grandviewresearch.com/industry-analysis/visual-intelligence-market-report,2025-05-20 00:00:00,Grand View Research,news,the global visual intelligence market size was estimated at usd 11432.0 million in 2024 and is projected to grow at a cagr of 19.1 from 2025 to 2030.,neutral,0.0
"ai complaint management market size industry report, 2033","the global ai complaint management market size was estimated at usd 5.29 billion in 2024 and is projected to reach usd 28.92 billion by 2033,...",https://www.grandviewresearch.com/industry-analysis/ai-complaint-management-market-report,2025-07-17 00:00:00,Grand View Research,news,"the global ai complaint management market size was estimated at usd 5.29 billion in 2024 and is projected to reach usd 28.92 billion by 2033,...",neutral,0.0
global ai market size 2031,"the market for artificial intelligence grew beyond billion us dollars in 2025, a considerable jump of nearly billion compared to 2023.",https://www.statista.com/forecasts/1474143/global-ai-market-size,2025-06-23 00:00:00,Statista,news,"the market for artificial intelligence grew beyond billion us dollars in 2025, a considerable jump of nearly billion compared to 2023.",positive,0.8160736560821533
artificial intelligence ai in animal health market,"innovative ai technologies are reshaping veterinary medicine and animal care by enhancing diagnostics, disease management, and personalized...",https://www.globenewswire.com/news-release/2025/04/17/3063263/28124/en/Artificial-Intelligence-AI-In-Animal-Health-Market-Global-Industry-Size-Share-Trends-Opportunity-and-Forecast-2020-2030F.html,2025-04-17 00:00:00,GlobeNewswire,news,"innovative ai technologies are reshaping veterinary medicine and animal care by enhancing diagnostics, disease management, and personalized...",neutral,0.0
"artificial intelligence market size worth usd 3,680.47 bn by 2034","according to precedence research, the global artificial intelligence market size is expected to be worth usd 3680.47 billion by 2034,...",https://www.globenewswire.com/news-release/2025/06/19/3102350/0/en/Artificial-Intelligence-Market-Size-Worth-USD-3-680-47-Bn-By-2034.html,2025-06-19 00:00:00,GlobeNewswire,news,"according to precedence research, the global artificial intelligence market size is expected to be worth usd 3680.47 billion by 2034,...",neutral,0.0
"growth trends and developments in the artificial intelligence ai industry, 20252033 featuring microsoft, ibm, amazon, baidu, nvidia, oracle, hpe, intel, salesforce, and alphabet","the artificial intelligence ai market globally is expected to grow at a huge rate, reaching us2.53 trillion by 2033 from us184.15 billion in 2024.",https://www.globenewswire.com/news-release/2025/01/27/3015780/28124/en/Growth-Trends-and-Developments-in-the-Artificial-Intelligence-AI-Industry-2025-2033-Featuring-Microsoft-IBM-Amazon-Baidu-Nvidia-Oracle-HPE-Intel-Salesforce-and-Alphabet.html,2025-01-27 00:00:00,GlobeNewswire,news,"the artificial intelligence ai market globally is expected to grow at a huge rate, reaching us2.53 trillion by 2033 from us184.15 billion in 2024.",positive,0.8875519037246704
artificial intelligence implications for real estate,our latest research report examines the implications of ai for real estate and provides insights into how investor and occupier ai strategies will transform...,https://www.jll.com/en-us/insights/artificial-intelligence-and-its-implications-for-real-estate,2025-03-29 00:00:00,JLL,news,our latest research report examines the implications of ai for real estate and provides insights into how investor and occupier ai strategies will transform...,neutral,0.0
"artificial intelligence market to grow at 36.6 cagr to garner 1,811.75 billion by 2030 grand view research, inc.","prnewswire the global artificial intelligence market size is expected to reach usd 1811.75 billion by 2030, growing at a cagr of 36.6...",https://www.prnewswire.com/news-releases/artificial-intelligence-market-to-grow-at-36-6-cagr-to-garner-1-811-75-billion-by-2030---grand-view-research-inc-302393076.html,2025-03-05 00:00:00,PR Newswire,news,"prnewswire the global artificial intelligence market size is expected to reach usd 1811.75 billion by 2030, growing at a cagr of 36.6...",neutral,0.0
"full article artificial intelligence in key pricing, reimbursement, and market access prma processes better, faster, cheapercan you really pick two?","research and experimentation with artificial intelligence ai in healthcare date back to the 1960s, starting with eliza, a natural language...",https://www.tandfonline.com/doi/full/10.1080/13696998.2025.2488154,2025-03-29 00:00:00,Taylor & Francis Online,news,"research and experimentation with artificial intelligence ai in healthcare date back to the 1960s, starting with eliza, a natural language...",neutral,0.0
the state of ai how organizations are rewiring to capture value,"in this latest version of the annual mckinsey global survey on ai, we look at the current trends that are driving real value from artificial...",https://www.mckinsey.com/capabilities/quantumblack/our-insights/the-state-of-ai,2025-03-12 00:00:00,McKinsey & Company,news,"in this latest version of the annual mckinsey global survey on ai, we look at the current trends that are driving real value from artificial...",neutral,0.0
is ai closing the door on entrylevel job opportunities?,"ai is reshaping the career ladder, putting entrylevel roles at risk while widening global talent pools. heres the job news to know,...",https://www.weforum.org/stories/2025/04/ai-jobs-international-workers-day/,2025-04-30 00:00:00,The World Economic Forum,news,"ai is reshaping the career ladder, putting entrylevel roles at risk while widening global talent pools. heres the job news to know,...",neutral,0.0
115 ai statistics trends of 2025 adoption growth data,"the ai industry is growing rapidly every year by nearly 17.3, and according to forecasts, ai will be valued at 738.7 billion by 2030.",https://www.demandsage.com/artificial-intelligence-statistics/,2025-07-18 00:00:00,DemandSage,news,"the ai industry is growing rapidly every year by nearly 17.3, and according to forecasts, ai will be valued at 738.7 billion by 2030.",neutral,0.0
"artificial intelligence ai market size, share, trends forecast 2032",key takeaways market trends insights. north america dominated the artificial intelligence ai market with a largest market share of 37.6 in 2024.,https://www.skyquestt.com/report/artificial-intelligence-ai-market,2025-05-29 00:00:00,SkyQuest Technology,news,key takeaways market trends insights. north america dominated the artificial intelligence ai market with a largest market share of 37.6 in 2024.,neutral,0.0
competitive intelligence tools strategic business report 20242030 expansion of ci tools in smes and emerging markets fueling the global 96 billion market,"the global market for competitive intelligence tools was estimated at us53.2 billion in 2023 and is projected to reach us96.0 billion by 2030, growing at a...",https://www.globenewswire.com/news-release/2025/01/13/3008676/28124/en/Competitive-Intelligence-Tools-Strategic-Business-Report-2024-2030-Expansion-of-CI-Tools-in-SMEs-and-Emerging-Markets-Fueling-the-Global-96-Billion-Market.html,2025-01-13 00:00:00,GlobeNewswire,news,"the global market for competitive intelligence tools was estimated at us53.2 billion in 2023 and is projected to reach us96.0 billion by 2030, growing at a...",positive,0.7304562330245972
"ai inference market size and trends industry report, 2030","ai inference market size, share trends analysis report by memory hbm, ddr, by compute, by application generative ai, machine learning, natural language...",https://www.grandviewresearch.com/industry-analysis/artificial-intelligence-ai-inference-market-report,2025-05-29 00:00:00,Grand View Research,news,"ai inference market size, share trends analysis report by memory hbm, ddr, by compute, by application generative ai, machine learning, natural language...",neutral,0.0
artificial intelligence executive briefing seventh edition strategic intelligence,this executive briefing will help you understand the impact of artificial intelligence ai on your business. it focuses on generative ai and the threats and...,https://www.globaldata.com/store/report/ai-theme-analysis-executive-briefing/,2025-06-24 00:00:00,Global Data,news,this executive briefing will help you understand the impact of artificial intelligence ai on your business. it focuses on generative ai and the threats and...,neutral,0.0
5 ai trends shaping innovation and roi in 2025,"learn what execs from the biggest tech companies shared about pioneering ai advancements in reasoning, frontier models and targeting roi for...",https://www.morganstanley.com/insights/articles/ai-trends-reasoning-frontier-models-2025-tmt,2025-03-20 00:00:00,Morgan Stanley,news,"learn what execs from the biggest tech companies shared about pioneering ai advancements in reasoning, frontier models and targeting roi for...",neutral,0.0
is ai already shaking up labor market?,a new paper by harvard economists david deming and lawrence h. summers offers early evidence of artificial intelligence shaking up the workforce.,https://news.harvard.edu/gazette/story/2025/02/is-ai-already-shaking-up-labor-market-a-i-artificial-intelligence/,2025-02-14 00:00:00,Harvard Gazette,news,a new paper by harvard economists david deming and lawrence h. summers offers early evidence of artificial intelligence shaking up the workforce.,neutral,0.0
6 edtech ai trends how artificial intelligence is reshaping education amazon web services,"... apr 2025 in announcements, artificial intelligence, best practices, edtechs, education, generative ai, higher education, public sector...",https://aws.amazon.com/blogs/publicsector/6-edtech-ai-trends-how-artificial-intelligence-is-reshaping-education/,2025-04-21 00:00:00,Amazon Web Services,news,"... apr 2025 in announcements, artificial intelligence, best practices, edtechs, education, generative ai, higher education, public sector...",neutral,0.0
artificial intelligence ai in healthcare market size to hit usd 613.81 bn by 2034,"the global artificial intelligence ai in healthcare market size is estimated to hit approximately usd 613.81 billion by 2034, up from usd...",https://www.globenewswire.com/news-release/2025/04/02/3054390/0/en/Artificial-Intelligence-AI-in-Healthcare-Market-Size-to-Hit-USD-613-81-Bn-by-2034.html,2025-04-02 00:00:00,GlobeNewswire,news,"the global artificial intelligence ai in healthcare market size is estimated to hit approximately usd 613.81 billion by 2034, up from usd...",positive,0.9317895770072937
artificial intelligence in the tourism business a systematic review,"the aim of this research is to explore the application of ai in the tourism industry, identifying the main ai technologies used in the business.",https://www.frontiersin.org/journals/artificial-intelligence/articles/10.3389/frai.2025.1599391/full,2025-07-14 00:00:00,Frontiers,news,"the aim of this research is to explore the application of ai in the tourism industry, identifying the main ai technologies used in the business.",neutral,0.0
"artificial intelligence skyrocketing, shaking the market with 3,680.47 bn by 2034",the worldwide artificial intelligence market has been evaluated at usd 757.58 billion in 2024 and is forecasted to reach around usd 3680.47...,https://www.globenewswire.com/news-release/2025/02/11/3024340/0/en/Artificial-Intelligence-Skyrocketing-Shaking-the-Market-with-3-680-47-Bn-by-2034.html,2025-02-11 00:00:00,GlobeNewswire,news,the worldwide artificial intelligence market has been evaluated at usd 757.58 billion in 2024 and is forecasted to reach around usd 3680.47...,negative,-0.6190571188926697
"ai in ophthalmology market size industry report, 2030","the global ai in ophthalmology market size was estimated at usd 209.23 million in 2024 and is projected to reach usd 1.36 billion by 2030, growing at a cagr of...",https://www.grandviewresearch.com/industry-analysis/artificial-intelligence-ai-ophthalmology-market-report,2025-05-30 00:00:00,Grand View Research,news,"the global ai in ophthalmology market size was estimated at usd 209.23 million in 2024 and is projected to reach usd 1.36 billion by 2030, growing at a cagr of...",neutral,0.0
artificial intelligence in agriculture unveiling trends in supply chain advancements,"the study examines global collaboration in aidriven agriculture and explores ai and machine learning ml applications across preproduction, production, and...",https://www.sciencedirect.com/science/article/pii/S2666188825002758,2025-05-21 00:00:00,ScienceDirect.com,news,"the study examines global collaboration in aidriven agriculture and explores ai and machine learning ml applications across preproduction, production, and...",neutral,0.0
artificial intelligence ai in healthcare research report,"the global artificial intelligence ai in healthcare market is poised for substantial growth, projected to ascend from usd 21.66 billion in 2025 to usd 110.61...",https://www.globenewswire.com/news-release/2025/06/04/3093732/28124/en/Artificial-Intelligence-AI-in-Healthcare-Research-Report-2025-Global-Forecast-to-2030-Key-Players-Expanding-their-Market-Share-Through-Product-Launches-and-Partnerships.html,2025-06-04 00:00:00,GlobeNewswire,news,"the global artificial intelligence ai in healthcare market is poised for substantial growth, projected to ascend from usd 21.66 billion in 2025 to usd 110.61...",positive,0.7552294135093689
artificial intelligence market report 2025 key data innovations,"explore the startus insights artificial intelligence market report 2025, covering key market data, technology trends, and innovative...",https://www.startus-insights.com/innovators-guide/artificial-intelligence-market-report/,2025-05-30 00:00:00,StartUs Insights,news,"explore the startus insights artificial intelligence market report 2025, covering key market data, technology trends, and innovative...",neutral,0.0
