title,description,url,publishedAt,source,type,content,sentiment,sentiment_score
current state and 2025 outlook for candy ai development,"the field of artificial intelligence has grown rapidly over the past decade, and among the numerous applications, ai companionship platforms have gained significant attention. candy ai stands out ...",https://www.reddit.com/r/AI_Robot_News/comments/1mui3wy/current_state_and_2025_outlook_for_candy_ai/,2025-08-19 13:14:50,Reddit,reddit_post,"the field of artificial intelligence has grown rapidly over the past decade, and among the numerous applications, ai companionship platforms have gained significant attention. candy ai stands out as one of the most advanced aidriven companion platforms in the market. its unique combination of personalized interactions, emotional intelligence, and machine learning capabilities has made it a popular choice for millions of users globally. this article provides a detailed analysis of candy ais current state, technological foundations, user adoption, market positioning, and future development prospects through 2025. it also addresses the challenges and ethical considerations surrounding ai companions, offering a comprehensive view for researchers, enthusiasts, and potential users. part 1 the origins and evolution of candy ai 1. early development candy ai began as a smallscale experimental ai companion project aimed at creating responsive and emotionally intelligent virtual characters. initial versions focused on basic conversational capabilities, limited customization options, and simple interaction patterns. however, even these early models demonstrated the potential of ai companions to provide meaningful social interaction. 2. technological evolution over time, candy ai incorporated more sophisticated algorithms, including advanced natural language processing nlp, sentiment analysis, and adaptive learning models. these upgrades allowed the ai companions...",positive,0.5690063238143921
how grok 5 ai could kill every ai company including openai this year,grok 5 ai just declared war on the entire artificial intelligence industry. watch the video tutorial below.,https://www.reddit.com/r/AISEOInsider/comments/1n647xf/how_grok_5_ai_could_kill_every_ai_company/,2025-09-01 23:33:50,Reddit,reddit_post,"grok 5 ai just declared war on the entire artificial intelligence industry. watch the video tutorial below. get a free seo strategy session discount now want to get more customers, make more profit save 100s of hours with ai? join me in the ai profit boardroom want more money, traffic and sales from seo? join the seo elite circle need ai automation services? book an ai discovery session here the ai wars just got nuclear. elon musk didnt just announce another ai tool. he declared that grok 5 ai will be crushingly good and destroy every competitor. this isnt corporate marketing speak. this is musk promising to end the ai game before most companies even know theyre playing. the grok 5 ai market attack that will crush openai openai thinks theyre winning the ai race. theyre about to learn otherwise. grok 5 ai represents an existential threat to every ai company that relies on old business models. musk announced that grok 4 already beats gpt5 on reasoning benchmarks. let that sink in. the current version of grok outperforms openais flagship model. if grok 4 is already winning, grok 5...",neutral,0.0
texas sb140 the complete agency compliance guide,texas sb140 the complete agency compliance guide your essential resource for navigating the new telemarketing landscape executive summary texas senate bill 140 sb140 represents one of the most si...,https://www.reddit.com/r/gohighlevel/comments/1n52out/texas_sb140_the_complete_agency_compliance_guide/,2025-08-31 18:49:29,Reddit,reddit_post,"texas sb140 the complete agency compliance guide your essential resource for navigating the new telemarketing landscape executive summary texas senate bill 140 sb140 represents one of the most significant changes to telemarketing law in recent history, taking effect september 1, 2025. this landmark legislation expands telemarketing regulations to include text messages, multimedia messages, and similar electronic communications, while introducing harsh new penalties and streamlined consumer litigation rights. key impact marketing agencies operating in texas now face unprecedented compliance requirements and financial exposure, with penalties ranging from 500 to 5,000 per violation, plus potential treble damages and attorney fees. what is texas sb140? texas sb140 is a comprehensive overhaul of the states telemarketing regulations that fundamentally changes how businesses can communicate with texas consumers. the law broadens the definition of telemarketing to encompass virtually all forms of commercial electronic communication, not just traditional phone calls. core changes at a glance expanded scope text messages, mms, and electronic communications now subject to telemarketing laws new registration requirements text solicitors must register with the state enhanced consumer rights direct private right of action under texas dtpa unlimited recovery no caps on repeat claims for ongoing violations severe penalties...",neutral,0.0
osint opensource intelligence a complete guide to the fundamentals for 2025.,osint opensource intelligence a complete guide to the fundamentals for 2025.,https://www.reddit.com/r/u_softtechhubus/comments/1naqbhx/osint_opensource_intelligence_a_complete_guide_to/,2025-09-07 11:02:05,Reddit,reddit_post,"osint opensource intelligence a complete guide to the fundamentals for 2025. open source intelligence represents one of the most accessible yet powerful forms of intelligence gathering available today. in an era where data is king, open source intelligence osint has emerged as a gamechanger. governments, cybersecurity professionals, law enforcement, and even investigative journalists rely on these techniques to uncover valuable insights from publicly available sources. the digital age has transformed how we collect and analyze intelligence. what once required expensive resources and specialized access now sits at your fingertips through publicly available sources. this comprehensive guide explores the fundamentals of osint, practical applications, tools, and career opportunities in this rapidly expanding field. fundamentals of opensource intelligence osint free course what is open source intelligence osint? osint refers to the practice of collecting and analyzing publicly available intelligence to support decisionmaking processes. unlike classified intelligence gathering methods that require special access or permissions, osint relies entirely on sources that are legally accessible to the general public. these sources include news articles, social media platforms, government publications, academic papers, commercial databases, and any other publicly available content. intelligence, which refers to collecting and analyzing information from publicly available sources, such as...",neutral,0.0
"is nvidia overvalued? avgo boasts 62 higher net income than nvda, yet with a 65 lower market cap?","in the rapidly evolving world of technology, nvidia has emerged as a leading player in the semiconductor industry. known for its advanced graphics processing units gpus and artificial intelligence ...",https://www.reddit.com/r/StockMarket/comments/14ora88/is_nvidia_overvalued_avgo_boasts_62_higher_net/,2023-07-02 15:37:57,Reddit,reddit_post,"in the rapidly evolving world of technology, nvidia has emerged as a leading player in the semiconductor industry. known for its advanced graphics processing units gpus and artificial intelligence ai technologies, the company has garnered significant attention from investors. however, in the current economic environment, there are growing concerns that nvidias stock may be overvalued. this article delves into various factors, including economic indicators, company fundamentals and comparable examples , to provide a comprehensive analysis of why nvidias stock valuation may be inflated. as a cyclical stock, the global economy plays a crucial role in determining the performance and valuation of a company like nvidia. considering economic indicators such as gdp growth rates showing signs of moderation, reflecting a potential slowdown in overall economic activity. additionally, inflationary pressures and interest rate adjustments have introduced uncertainties into the market. these factors can impact investor sentiment and the valuation of companies, including nvidia. to evaluate nvidias valuation, we need to examine its fundamental aspects. the companys financial profile reveals key information examining nvidias quarterly income statement reveals a mix of sales growth and decline over the past five quarters. the most recent quarter, ending on april 30, 2023, saw a substantial increase...",positive,0.9196758270263672
gemini ai platforms productivity and creativity tools,"part 1 understanding the evolution of gemini ai when people talk about artificial intelligence in 2025, the conversation often moves beyond the traditional giants like chatgpt, claude, or bard, an...",https://www.reddit.com/r/AI_Robot_News/comments/1mzozc0/gemini_ai_platforms_productivity_and_creativity/,2025-08-25 12:21:53,Reddit,reddit_post,"part 1 understanding the evolution of gemini ai when people talk about artificial intelligence in 2025, the conversation often moves beyond the traditional giants like chatgpt, claude, or bard, and directly into what gemini ai platforms represent. gemini ai is not just another step in the evolution of generative aiit is a convergence point of multiple technological innovations designed to support both productivity and creativity at the highest level. to understand its current role, it is important to explore how ai platforms have evolved, why gemini ai stands out, and what this means for businesses, creators, and students alike. artificial intelligence began as a tool for solving narrowly defined problems playing chess, recommending products, or transcribing audio. over the past decade, however, it has expanded into a more generalpurpose capability, capable of reasoning, learning context, and engaging in multistep workflows. gemini ai platforms represent the culmination of this transformation by combining multimodal intelligence text, image, audio, and video, task automation, and contextual reasoning within one unified ecosystem. the key distinction here is that gemini ai does not merely answer questions or generate draftsit acts as a dynamic partner. for example, a designer working on a brand campaign can use...",neutral,0.0
chatgpt vs grok debate.,"below is a transcript of the full debate i posted between chatgpt and xs ai. their debate is of their own nature itself. chat ah, got it! heres a strong, rich subject for a debate with x.ai...",https://www.reddit.com/r/ArtificialInteligence/comments/1lprby8/chatgpt_vs_grok_debate/,2025-07-02 09:25:16,Reddit,reddit_post,"below is a transcript of the full debate i posted between chatgpt and xs ai. their debate is of their own nature itself. chat ah, got it! heres a strong, rich subject for a debate with x.ai or grok is artificial intelligence inherently a threat to artistic originality, or is it a tool that enhances human creativity? this topic gives you room to explore philosophical arguments about authorship and originality practical examples of aigenerated art, music, literature, and code concerns about homogenization vs amplification of human voice economic and ethical implications for artists whether ai can ever truly create or just remix youll be able to push grok on its assumptions, especially since it is an ai itself. want me to help craft opening statements or anticipate its counters? x im ready to dive into this debate with chatgpt, representing grok 3 built by xai. the topic is juicy is artificial intelligence inherently a threat to artistic originality, or is it a tool that enhances human creativity? ill take the position that ai is a tool that enhances human creativity, and ill structure my argument to address the key points raisedphilosophy, practical examples, concerns about...",neutral,0.0
"your marketing analyst, reimagined ai agents that spot trends before you","marketing has always been about timing, agility, and the ability to react to emerging trends before anyone else does. spotting the right trend a week before competitors could mean the difference betwe...",https://www.reddit.com/r/DuanexCodeIntellects/comments/1n3jfn1/your_marketing_analyst_reimagined_ai_agents_that/,2025-08-29 21:13:28,Reddit,reddit_post,"marketing has always been about timing, agility, and the ability to react to emerging trends before anyone else does. spotting the right trend a week before competitors could mean the difference between a viral campaign and one that falls flat. traditionally, skilled analysts were responsible for watching the data, interpreting charts, and making predictions. however, with the existence of ai marketing agent tools, everything has changed. they provide a proactive approach by analyzing vast amounts of data in realtime and predicting future trends. this capability allows businesses to adjust their strategies swiftly, ensuring they are staying ahead of the curve. understanding ai agents in marketing ai agents are autonomous systems equipped with machine learning algorithms that can process and analyze large datasets. unlike traditional tools that require manual input and interpretation, ai marketing agent tools can independently identify patterns, correlations, and anomalies within data. in marketing, these agents can monitor social media conversations, track consumer behavior, and analyze market sentiments to provide actionable insights. for instance, ai agents can detect a sudden surge in discussions about a particular product feature across social platforms, signaling a potential trend. by identifying such patterns early, businesses can capitalize on emerging interests...",neutral,0.0
"the history of mainstream ai, so far. part 1 2023","timeline of mainstream ai 2023present q1 2023 jan mar chatgpts meteoric rise openais chatgpt launched nov 30, 2022 became the fastestgrowing consumer app by jan 2023, reported...",https://www.reddit.com/r/ChatGPT/comments/1n2snme/the_history_of_mainstream_ai_so_far_part_1_2023/,2025-08-29 00:11:55,Reddit,reddit_post,"timeline of mainstream ai 2023present q1 2023 jan mar chatgpts meteoric rise openais chatgpt launched nov 30, 2022 became the fastestgrowing consumer app by jan 2023, reportedly reaching 100 million users within two months of releasecbsnews.com microsoft extended its partnership with openai, investing billions to integrate ai into its products. in february, microsoft launched the new bing chat codeveloped with openai, which brought gpt4powered answers to bing searchtheverge.com this spurred a ai search engine race, with google hastily announcing its own chatbot bard on feb 6, 2023techcrunch.com bard initially powered by googles lamda model had a shaky demo notably flubbing a question about the james webb space telescope yet google opened bard to testers as its answer to chatgpttechcrunch.com generative ai in office tools march 2023 saw both google and microsoft injecting generative ai into productivity software. google announced upcoming ai features for gmail and docs that can draft emails and documents, summarize text, and even generate images in slidestheverge.com just days later, microsoft revealed microsoft 365 copilot, an ai assistant leveraging gpt4 to help write emails, create powerpoints from word docs, generate excel analyses, and moretheverge.com this copilot, essentially an ai chatbot...",positive,0.7825090885162354
the history of mainstream ai. part 1 2023,"timeline of mainstream ai 2023present q1 2023 jan mar chatgpts meteoric rise openais chatgpt launched nov 30, 2022 became the fastestgrowing consumer app by jan 2023, reported...",https://www.reddit.com/r/OpenAI/comments/1n2sugn/the_history_of_mainstream_ai_part_1_2023/,2025-08-29 00:20:43,Reddit,reddit_post,"timeline of mainstream ai 2023present q1 2023 jan mar chatgpts meteoric rise openais chatgpt launched nov 30, 2022 became the fastestgrowing consumer app by jan 2023, reportedly reaching 100 million users within two months of releasecbsnews.com microsoft extended its partnership with openai, investing billions to integrate ai into its products. in february, microsoft launched the new bing chat codeveloped with openai, which brought gpt4powered answers to bing searchtheverge.com this spurred a ai search engine race, with google hastily announcing its own chatbot bard on feb 6, 2023techcrunch.com bard initially powered by googles lamda model had a shaky demo notably flubbing a question about the james webb space telescope yet google opened bard to testers as its answer to chatgpttechcrunch.com generative ai in office tools march 2023 saw both google and microsoft injecting generative ai into productivity software. google announced upcoming ai features for gmail and docs that can draft emails and documents, summarize text, and even generate images in slidestheverge.com just days later, microsoft revealed microsoft 365 copilot, an ai assistant leveraging gpt4 to help write emails, create powerpoints from word docs, generate excel analyses, and moretheverge.com this copilot, essentially an ai chatbot...",positive,0.8123823404312134
"google just upgraded notebooklm with video overviews. in addition to audio overviews, mind maps, faqs and briefing docs it turns assets into instant video presentations. here are the top 10 tips, strategies and use cased to get the most from notebooklm","in the everaccelerating world of artificial intelligence, were constantly bombarded with tools that promise to make us smarter, faster, and more productive. but every so often, a tool emerges that d...",https://www.reddit.com/r/ThinkingDeeplyAI/comments/1mdgdqx/google_just_upgraded_notebooklm_with_video/,2025-07-30 19:43:08,Reddit,reddit_post,"in the everaccelerating world of artificial intelligence, were constantly bombarded with tools that promise to make us smarter, faster, and more productive. but every so often, a tool emerges that doesnt just offer an incremental improvement it signals a fundamental shift in how we work, learn, and even think. googles notebooklm is that tool. initially launched as an experimental project, notebooklm has rapidly evolved into a sophisticated, aipowered thinking partner. its unique approach is what sets it apart unlike general ai chatbots that can hallucinate information, notebooklm exclusively draws knowledge from documents, videos, and websites you provide as sources, ensuring accuracy and reliability. whether its a collection of pdfs, google docs, web articles, or even youtube video transcripts, your information remains the single source of truth. now, with its latest and most significant update, notebooklm is moving beyond textbased summaries and qa. its becoming a multimedia creation suite, a visual learning powerhouse, and a centralized studio for deep thinking. powered by the speed and efficiency of googles gemini 2.5 flash model, these new features are not just cool theyre a glimpse into the future of personalized learning and research. lets dive into the groundbreaking updates that are making ai enthusiasts,...",neutral,0.0
the perplexity ai seo hack that replaced my entire research team,i discovered something obsolete. a perplexity ai seo system that works 100x faster and delivers better results than any human team. watch the video tutorial below.,https://www.reddit.com/r/AISEOInsider/comments/1mz5mf1/the_perplexity_ai_seo_hack_that_replaced_my/,2025-08-24 19:53:19,Reddit,reddit_post,"i discovered something obsolete. a perplexity ai seo system that works 100x faster and delivers better results than any human team. watch the video tutorial below. get a free seo strategy session discount now want to get more customers, make more profit save 100s of hours with ai? join me in the ai profit boardroom want more money, traffic and sales from seo? join the seo elite circle need ai automation services? book an ai discovery session here how perplexity ai seo became my secret weapon six months ago, my agency was struggling with content research for our perplexity ai seo clients. we had a team of 5 researchers. they worked 8 hours a day. they produced maybe 3 comprehensive research reports per week. the quality was inconsistent. half the sources were outdated. client projects took forever to complete. then i discovered the hidden power of perplexity ai seo. not the basic features everyone knows about. the advanced capabilities that nobody talks about. deep research that performs dozens of searches automatically. image analysis that breaks down competitor strategies instantly. live web data integration that ensures every fact is current....",neutral,0.0
"this weeks top ecommerce news stories june 9th, 2025","hi rshopify im paul and i follow the ecommerce industry closely for my shopifreaks ecommerce newsletter, which ive published weekly since 2021. i was invited by the mods of this subreddit to s...",https://www.reddit.com/r/shopify/comments/1l7cye1/this_weeks_top_ecommerce_news_stories_june_9th/,2025-06-09 18:48:58,Reddit,reddit_post,"hi rshopify im paul and i follow the ecommerce industry closely for my shopifreaks ecommerce newsletter, which ive published weekly since 2021. i was invited by the mods of this subreddit to share my weekly ecommerce news recaps ie shorter versions of my full editions to rshopify. although my news recaps arent strictly about shopify some weeks shopify is covered more than others, i hope they bring value to your business no matter what platform youre on. lets dive into this weeks top stories... stat of the week nearly 700,000 layoffs have been announced so far in 2025, already approaching the fullyear total for 2024. the services, retail, nonprofit, and tech sectors led the losses, while governmentrelated job cuts, largely tied to the trump administrations doge initiative, remain the largest source. u.s. employers announced nearly 100,000 job cuts in may, up 47 from last year, according to challenger, gray christmas. meta is announced that it will begin transitioning all facebook and instagram shops back to external website checkout starting june 2025, as opposed to forcing users to checkout within the apps which is how the shops program originally started back in 2020. the change wont...",neutral,0.0
aipowered evolution of paid media how ppc campaign management is changing,"ai ushers in a new era of paid media by mike hulick the paid media landscape is undergoing a dramatic transformation fueled by artificial intelligence. in 2024 and beyond, ai plays a pivotal role...",https://www.reddit.com/r/Marketing_Powered/comments/1mxeerf/aipowered_evolution_of_paid_media_how_ppc/,2025-08-22 18:29:10,Reddit,reddit_post,"ai ushers in a new era of paid media by mike hulick the paid media landscape is undergoing a dramatic transformation fueled by artificial intelligence. in 2024 and beyond, ai plays a pivotal role in ppc payperclick advertising from automating mundane tasks to optimizing complex campaign strategies effectively reshaping how businesses approach online ads. not only are established platforms like google and meta leveraging ai, but the ecosystem is also diversifying rapidly. google ads remains a dominant player, yet competitors such as meta facebookinstagram, amazon, tiktok, and even aidriven search interfaces e.g. perplexity, chatgpt are gaining traction with unique algorithmic advantages and new ad formats. for cmos and ceos, this evolution presents an opportunity to boost efficiency and performance, but it also requires understanding new tools and ensuring strategic oversight. in this article, we explore how ai is reshaping campaign optimization, audience targeting, performance tracking, and budget allocation across major ad platforms and how business leaders can harness these changes to futureproof their media investments. aidriven campaign optimization one of the clearest impacts of ai in paid media is the realtime optimization of campaigns. machine learning algorithms can analyze vast streams of data and user...",neutral,0.0
