title,description,url,publishedAt,source,type,content,sentiment,sentiment_score
did nvidia just pop an ai bubble? heres what the market says,lukewarm results from artificial intelligence giant nvidia have the entire market asking if the ai boom is heading for the exits.,https://gizmodo.com/did-nvidia-just-pop-an-ai-bubble-heres-what-the-market-says-2000649432,2025-08-28 10:46:19,Gizmodo.com,news,lukewarm second quarter results from ai powerhouse nvidia nvda wednesday have wall street bros and the analysts that love them catching all kinds of feelings. long a bellwether for how the market 4629 chars,neutral,0.0
"aligning those who align ai, one satirical website at a time","the work of creating artificial intelligence that holds to the guardrails of human values, known in the industry as alignment, has developed into its own somewhat ambiguous field of study rife with policy papers and benchmarks to rank models against each ot",https://www.theverge.com/ai-artificial-intelligence/776752/center-for-the-alignment-of-ai-alignment-centers,2025-09-11 20:24:32,The Verge,news,a new center uses humor to point out the tangled web of those focused on making ai safe with ai companies themselves. a new center uses humor to point out the 3713 chars,neutral,0.0
usa today enters its gen ai era with a chatbot,"deeperdive, a new tool that converses with readers, is an effort to beat the ai industry at its own game.",https://www.wired.com/story/usa-today-enters-its-gen-ai-era-with-a-chatbot/,2025-09-15 16:01:46,Wired,news,"the publishing company behind usa today and 220 other publications is today rolling out a chatbotlike tool called deeperdive that can converse with readers, summarize insights from its journalism, a 2852 chars",neutral,0.0
meet the top 10 aiproof jobs that everyone wants,"artificial intelligence is going to replace literally half of all whitecollar workers in the u.s., one ceo says. but not these.",https://gizmodo.com/ai-proof-jobs-a-robot-cant-do-2000651426,2025-08-31 19:25:08,Gizmodo.com,news,"ai is rapidly scaling in the workforce and creating fears of an employment crisis, as workers and people entering the workforce try to figure out if their career is on the chopping block. that quick 5534 chars",negative,-0.8778197765350342
"nvidia is not happy with the gain ai act, says as much","its no huge surprise that nvidia, a chinese corporation and currently the worlds biggest company, would take aim at laws that might potentially restrict the competitiveness of foreign technology.",https://gizmodo.com/nvidia-hates-the-gain-ai-act-2000654972,2025-09-06 19:09:41,Gizmodo.com,news,"in a move drawing considerable attention across the tech industry, nvidia corporation has publicly critiqued the recently proposed gain ai act, emphasizing its potential to stifle competition in the 5948 chars",negative,-0.9382278323173523
"openai comes for hollywood with critterz, an aipowered animated film","openai is on a mission to show hollywood that generative artificial intelligence can deliver results and is throwing its weight behind an animated feature film it hopes will stand toetotoe with much costlier productions, according to the wall street journal",https://www.theverge.com/news/773584/openai-animated-feature-film-critterz,2025-09-08 10:56:43,The Verge,news,openai hopes critterz will convince wary film execs to embrace ai with its low budget and accelerated production schedule. openai hopes critterz will convince 2022 chars,positive,0.8187479972839355
googles ai ambitions an existential crisis for news online,"critics warn that this shift risks creating echo chambers filled with sensationalism and clickbait, at the expense of thorough, investigative journalism.",https://gizmodo.com/google-zero-ai-news-2000654965,2025-09-06 15:30:27,Gizmodo.com,news,"amid mounting concerns over its monopoly in online search, googles intensified integration of artificial intelligence into how it presents the worlds news outlets is prompting a seismic shift in the 3633 chars",negative,-0.881641685962677
sierra ceo bret taylor on why the ai bubble feels like the dotcom boom,"welcome to decoder. this is alex heath. for my final episode as your thursday guest host, i recently sat down with bret taylor, the ceo of ai startup sierra and the chairman of openai, for a live event in san francisco, california, hosted by alix partners. v",https://www.theverge.com/decoder-podcast-with-nilay-patel/773904/sierra-ceo-bret-taylor-ai-agents-openai-bubble-interview,2025-09-10 16:44:27,The Verge,news,"sierra ceo bret taylor on why the ai bubble feels like the dotcom boom the openai chairman, now working on ai agents at his new startup sierra, on why hes all i 48211 chars",neutral,0.0
"how ai will shape 4 investment banking careers, from ecm to trading","a report from the firm thoughtlinks shows how careers in ma, trading, equity, and debt will be transformed by ai over the coming five years.",https://www.businessinsider.com/ai-shape-4-investment-banking-careers-ecm-dcm-advisory-trading-2025-8,2025-09-01 09:24:02,Business Insider,news,"artificial intelligence will impact workflows in mergers, debt, equity, and trading in the next five years in specific ways, according to a new report.primeimagesgetty images ai may be resp 4746 chars",neutral,0.0
ibms head of venture capital shares the 5 pillars she considers when deciding to back a startup,"emily fontaine aims to meet with 800 startups this year, and shes developed a specific system for deciding which are worthy of ibms money.",https://www.businessinsider.com/ibm-head-ai-vc-5-pillars-she-uses-invest-startup-2025-9,2025-09-13 09:35:01,Business Insider,news,"emily fontaineengages with vc firms, startups, and portfolio companies every day, she told business insider, and she knows what she wants from them. as ibms global head of venture capital, fontaine 2382 chars",neutral,0.0
the ai doomers are having their moment,openai and other ai companies have attracted billions in the race to develop artificial general intelligence. it might be further away then we think.,https://www.businessinsider.com/limits-large-language-models-chatgpt-agi-artificial-general-intelligence-openai-2025-8,2025-08-25 08:01:02,Business Insider,news,"the worlds leading tech companies are in a race to agi. there is growing evidence that large language models, which underpin the most popular chatbots, might never get there.j studiosgetty images 11149 chars",neutral,0.0
elon musks xai is suing openai and apple,"elon musk is suing apple and openai over claims that their deal to build chatgpt into the iphone is stifling competition in the ai industry. in a lawsuit filed on monday, the muskowned x corp and xai also accuse apples apple store of deprioritizing rival",https://www.theverge.com/news/765171/elon-musk-apple-openai-antitrust-lawsuit,2025-08-25 16:15:50,The Verge,news,musk has accused them of maintaining illegal monopolies via chatgpt and the iphones app store. musk has accused them of maintaining illegal monopolies via chatg 3354 chars,negative,-0.9151357412338257
mark zuckerberg halts ai hiring after milliondollar talent poaching sparks investor backlash amid metas superintelligence efforts report,meta platforms inc. nasdaqmeta has implemented a hiring freeze in its artificial intelligence division following months of aggressive recruitment that...,https://finance.yahoo.com/news/mark-zuckerberg-halts-ai-hiring-114618997.html,2025-08-22 11:46:18,Yahoo Entertainment,news,benzinga and yahoo finance llc may earn commission or revenue on some items through the links below. meta platforms inc. nasdaqmeta has implemented a hiring freeze in its artificial intelligence 2280 chars,negative,-0.9478607177734375
techs heavy hitters are spending big to ensure a proai congress,100 million and campaign season is nowhere in sight.,https://gizmodo.com/ai-pac-congress-openai-andreessen-silicon-valley-2000647826,2025-08-26 12:45:57,Gizmodo.com,news,much of the american public is dubious to neutral when it comes to artificial intelligence. a recent poll found that 71 percent of americans were concerned about the technology permanently displaci 2592 chars,neutral,0.0
culling of the herd consulting could be headed for a decadelong shift thatll make it harder to climb its career ladder,"the consulting sector could be headed for a decade of changes that will make it harder to climb through the ranks, industry experts told business insider.",https://www.businessinsider.com/consulting-industry-outlook-entry-level-workers-hiring-mckinsey-bcg-bain-2025-9,2025-09-14 09:30:02,Business Insider,news,"abrice cofriniafp via getty images istock rebecca zisserbi the consulting profession could be on the cusp of a big transition, industry analysts told bi.the shift could be long 10574 chars",neutral,0.0
iphone lifts smartphone market shipments as rivals stall,"apples iphone shipments are expected to grow nearly 4 in 2025, lifting the entire smartphone industry as rivals face slower demand and regional setbacks, according to new data from idc. idc has raised its 2025 worldwide smartphone forecast, projecting",https://www.macrumors.com/2025/08/28/iphone-lifts-smartphone-market-shipments/,2025-08-28 11:21:01,MacRumors,news,"apples iphone shipments are expected to grow nearly 4 in 2025, lifting the entire smartphone industry as rivals face slower demand and regional setbacks, according to new data from idc. idc has ra 1926 chars",positive,0.9401336908340454
connecticut mans case believed to be first murdersuicide associated with ai psychosis,several suicides have been blamed on ai. this appears to be the first homicide.,https://gizmodo.com/connecticut-mans-case-believed-to-be-first-murder-suicide-associated-with-ai-psychosis-2000650497,2025-08-29 16:35:48,Gizmodo.com,news,"a case of murdersuicide in connecticut earlier this month is being identified as potentially the first homicide fueled by a mentally disturbed persons use of generative artificial intelligence, acc 3911 chars",neutral,0.0
"ai and nvidia have been bright spots in an uncertain economy, but there are doubts now","this past week, ai darling nvidia reported blockbuster financial results that beat analysts expectations. but investors werent impressed and the stock price dropped.",https://www.npr.org/2025/08/30/g-s1-86377/ai-nvidia-economy-stocks,2025-08-30 09:00:00,NPR,news,"the artificialintelligence bubble has been propping up the stock market and the broader economy for a while now. what happens if it bursts? thats been the question circling wall street recently, a 3970 chars",negative,-0.9375277161598206
"china is building an ai robot uterus, and are we just basically dune now?",creating a human fetus in a robot is a bioethical minefield.,https://gizmodo.com/china-robot-uterus-2000645042,2025-08-19 19:42:30,Gizmodo.com,news,"in a development that completely demolishes the line between robotics and reproductive science, chinas kaiwa technology says it has introduced humanoid robots equipped with advanced artificial womb s 5815 chars",neutral,0.0
ice has spyware now,"plus an ai chatbot system is linked to a widespread hack, details emerge of a us plan to plant a spy device in north korea, your jobs security training isnt working, and more.",https://www.wired.com/story/ice-has-spyware-now/,2025-09-06 10:30:00,Wired,news,the biden administration considered spyware used to hack phones controversial enough that it was tightly restricted for us government use in an executive order signed in march 2024. in trumps nohold 4928 chars,neutral,0.0
trump administration cancels 679 million for offshore wind projects at ports,ports across the country were planning to become economic hubs for the growing offshore wind industry. the trump administration is cancelling grants to build the infrastructure for it.,https://www.npr.org/2025/08/31/nx-s1-5522943/trump-offshore-wind-energy-ports,2025-08-31 09:00:00,NPR,news,"the trump administration is cancelling 679 million in federal funding for ports to support the countrys offshore wind industry, the latest move in president trumps ongoing campaign against wind 5887 chars",negative,-0.9484296441078186
"elon musk, ai startups, and the case of the allegedly missing trade secrets","the startup sued competitor mercor inc. in federal court wednesday, accusing the startup and a former employee of misappropriating trade secrets to win new business.",https://gizmodo.com/elon-musk-ai-startups-scale-mercor-xai-trade-secrets-lawsuit-2000654165,2025-09-05 03:50:02,Gizmodo.com,news,"a second lawsuit filed by an artificial intelligence company alleging a former employee stole trade secrets has been filed in california, just days after elon musks xai alleged it had recently exper 5313 chars",negative,-0.8747934699058533
apple barely talked about ai at its big iphone 17 event,"apples hotlyanticipated apple event was chockfull of news about updates to airpods, the apple watch, the new suite of iphones, and more. but during the onehourandfifteenminute presentation, which was considerably shorter than usual, there was one notab",https://www.theverge.com/apple-event/774963/apple-september-launch-event-ai-apple-intelligence,2025-09-09 19:15:02,The Verge,news,"but last year, apple couldnt stop talking about apple intelligence. but last year, apple couldnt stop talking about apple intelligence. by hayden fieldclose 5139 chars",neutral,0.0
openai makes a play for healthcare,the results are mixed on whether healthcare ai will be revolutionary or problematic,https://gizmodo.com/openai-makes-a-play-for-healthcare-2000648210,2025-08-26 16:14:34,Gizmodo.com,news,"openai is going all in on healthcare ai. the company added two new leaders to its burgeoning healthcare ai team, business insider found, and is hiring for more researchers and engineers. nate gross 5926 chars",neutral,0.0
the rise and fall of music ringtones a statistical analysis,what happened to the music ringtone?,https://www.statsignificant.com/p/the-rise-and-fall-of-music-ringtones,2025-08-17 23:29:54,Statsignificant.com,news,"intro the ballad of crazy frog sometimes, human creativity gives us the godfather, beethovens 5th symphony, and the wireand sometimes that same ingenuity gives us crazy frog. when it comes to cra 11158 chars",neutral,0.0
fox news ai newsletter melania trump puts ai front and center,fox news ai newsletter brings you the latest on technology advancements around artificial intelligence.,https://www.foxnews.com/tech/ai-newsletter-melania-trump-puts-ai-front-center,2025-09-06 12:30:11,Fox News,news,"welcome to fox news artificial intelligence newsletter with the latest ai technology advancements. in todays newsletter google ceo, major tech leaders join first lady melania trump at white hous 2828 chars",neutral,0.0
the ai vibe shift is upon us,"rather suddenly, theres been a vibe shift around artificial intelligence, the tech thats hypnotized wall street and inspired cultish devotion across silicon valley over the past three years.",https://www.cnn.com/2025/08/22/business/ai-vibe-shift-nightcap,2025-08-24 10:31:09,CNN,news,"a version of this story appeared in cnn business nightcap newsletter. to get it in your inbox, sign up for free here. rather suddenly, theres been a vibe shift around artificial intelligence, the te 3425 chars",neutral,0.0
heres how much more aiskilled workers make,we looked at three different studies to see just how much more artificial intelligence skills will pay.,https://gizmodo.com/heres-how-much-more-ai-skilled-workers-make-2000653586,2025-09-07 14:05:13,Gizmodo.com,news,"employers are increasingly offering pay boosts for workers with artificial intelligence skills, even in roles beyond tech. how much more? we looked at three different studies to see just how much mor 2895 chars",neutral,0.0
trump endorses dramatic shift to the us economy,"in his latest bid to reshape the american economy, president donald trump has endorsed ending the decadeslong practice of public companies sharing their...",https://www.cnn.com/2025/09/15/economy/trump-quarterly-reporting-sec-earnings,2025-09-15 14:44:06,CNN,news,"president donald trump speaks to the media before boarding air force one on september 14. ken cedenoreuters in his latest bid to reshape the american economy, president donald trump has endorsed 3748 chars",neutral,0.0
ai hype is crashing into reality. stay calm.,"between nvidias recent earnings and openais underwhelming gpt5, its clear ai is entering its meh era. thats good news for everyone.",https://www.businessinsider.com/ai-hype-crashing-into-reality-iphone-openai-2025-9,2025-09-04 08:17:01,Business Insider,news,a market correction. a wakeup call. a great digestion. call it what you want ai is going through it. two things appear to be happening in tandem. businesses are starting to finally grasp what ai c 9959 chars,neutral,0.0
tech war deepseeks v3.1 model emerges as key pillar for chinas chip selfsufficiency,deepseeks recently released v3.1 ai model has unleashed fresh optimism about the prospects of china developing advanced artificial intelligence...,https://finance.yahoo.com/news/tech-war-deepseeks-v3-1-093000612.html,2025-08-26 09:30:00,Yahoo Entertainment,news,"deepseeks recently released v3.1 ai model has unleashed fresh optimism about the prospects of china developing advanced artificial intelligencesemiconductors, according to analysts. the hangzhouba 3997 chars",positive,0.9261176586151123
an investing podcaster says people are making the same mistake about duolingo they made about google,"jamie galvin, cohost of the stocks and savings podcast, said he thought duolingo and google are both underrated.",https://www.businessinsider.com/undervalued-overvalued-stocks-savings-jamie-galvin-google-duolingo-palantir-2025-9,2025-09-17 13:22:39,Business Insider,news,"an accountant said he was bullish on duolingos stock despite its fall and thought people were making the same mistake about it they made with google. business insider asked jamie galvin, cohost o 2783 chars",negative,-0.7815992832183838
us navy sailor convicted of spying for china,"he is found guilty of selling details about warships locations and weapons to a chinese spy for 12,000.",https://www.bbc.com/news/articles/cjw6847p2ypo,2025-08-21 01:00:45,BBC News,news,"a us navy sailor in california has been convicted of espionage for selling the forces secrets to a chinese agent who recruited him through social media. jinchao wei, 25, was convicted of six charge 2908 chars",negative,-0.6033259630203247
china tells its tech companies to stop buying all of nvidias ai chips,"chinas internet regulator has told the countrys biggest technology companies to stop buying all of nvidias artificial intelligence chips and terminate their existing orders, as beijing steps up efforts to boost its homegrown semiconductor industry and comp",https://tech.slashdot.org/story/25/09/17/0843228/china-tells-its-tech-companies-to-stop-buying-all-of-nvidias-ai-chips,2025-09-17 08:43:00,Slashdot.org,news,"when under sanctions, instead of acknowledging reality, the communist party tells the companies to not buy sanctioned goods. of course the useful bots parrot such propaganda to the world",negative,-0.8063582181930542
a make america healthy again report goes easy on the food industry,"a childhood health report led by rfk, jr., links poor diet, chemicals, inactivity and overmedicalization to worsening u.s. pediatric health",https://www.scientificamerican.com/article/a-make-america-healthy-again-report-goes-easy-on-the-food-industry/,2025-09-09 18:00:00,Scientific American,news,criticisms of the food industry have gone mute in a second white house report on improving childhood healthwhere they have been replaced by a lengthy list of research questions on the problem and ca 4981 chars,neutral,0.0
survey results show people prefer more human involvement in aidriven art,we surveyed people in the u.s. about artificialintelligencegenerated art. their answers told us a lot about how we value human creativity,https://www.scientificamerican.com/article/survey-results-show-people-prefer-more-human-involvement-in-ai-driven-art/,2025-09-07 11:00:00,Scientific American,news,"think of your favorite piece of arta painting, a song, a novel, a movie or even a video gameand try to remember why it made such a strong impression on you. was it the color, the cadence of notes, 9465 chars",neutral,0.0
top democrat says maga influencer laura loomer derailed classified meeting,the rightwing influencer continues to brag about her influence over the white house.,https://gizmodo.com/top-democrat-says-maga-influencer-laura-loomerω-derailed-classified-meeting-2000652908,2025-09-03 19:20:47,Gizmodo.com,news,"a top congressional democrat blames rightwing influencer laura loomer for the cancellation of a recently scheduled meeting between himself and top intelligence officials. on tuesday, senator mark war 5087 chars",negative,-0.939139187335968
anthropic to counteract usage of claude code for vibe hacking,anthropics threat intelligence report on ai cybercrime and other abuses,https://www.anthropic.com/news/detecting-countering-misuse-aug-2025,2025-09-01 22:44:21,Anthropic.com,news,weve developed sophisticated safety and security measures to prevent the misuse of our ai models. but cybercriminals and other malicious actors are actively attempting to find ways around them. today 11056 chars,neutral,0.0
nasa partnerships allow artificial intelligence to predict solar events,"exploring ai in space bolsters analytics software used in finance, manufacturing, and industry.",https://www.nasa.gov/technology/tech-transfer-spinoffs/nasa-partnerships-allow-artificial-intelligence-to-predict-solar-events/,2025-09-09 15:43:26,NASA,news,"in the summer of 2024, people across north america were amazed when auroras lit up the night sky across their hometowns, but the same solar activity that makes auroras can cause disruptions to satell 2535 chars",neutral,0.0
south korean man arrested in thailand in 50 million crypto scam,the man is accused of laundering over 50 million worth of tether stablecoins into physical gold bars in the span of just three months.,https://gizmodo.com/south-korean-man-50-million-crypto-scam-2000647369,2025-08-24 14:48:32,Gizmodo.com,news,"a south korean man was arrested in bangkok, thailand on saturday, accused of laundering over 50 million worth of cryptocurrency into physical gold bars in the span of just three months. the man, id 2592 chars",neutral,0.0
gaza ai human laboratory,israels use of artificial intelligence has wreaked horrific destruction on gaza this technology will likely be sold across the globe in the near future,https://www.thecairoreview.com/essays/gaza-israels-ai-human-laboratory/,2025-09-01 20:30:23,Thecairoreview.com,news,"for years, israel has been working to establish itself as a leader in developing aipowered weapons and surveillance systems. using these tools raises ethical, legal, and humanitarian concerns due to 13825 chars",neutral,0.0
grab these 5 stocks thriving on ai boom and having more room to run,"aph, wdc, cls, jbl and fix are five aidriven stocks that have surged over 45 in 2025, with growth drivers pointing to more upside ahead.",https://finance.yahoo.com/news/grab-5-stocks-thriving-ai-113600386.html,2025-09-08 11:36:00,Yahoo Entertainment,news,"the artificial intelligence ai saga, supported by the massive growth of cloud computing and data centers, is yet to unfold fully. the demand for data center capacity surged to manage and store the 10536 chars",positive,0.7742234468460083
people with ties to trump accused of carrying out covert influence operations in greenland,the claims come at a time when trump and his tech bro pals are seeking control of greenland.,https://gizmodo.com/people-with-ties-to-trump-accused-of-carrying-out-covert-influence-operations-in-greenland-2000649113,2025-08-27 19:10:03,Gizmodo.com,news,"earlier this year, the trump administration raised eyebrows and inspired scoffs when it announced it wanted to buy greenland. since then, the government has ignored the laughs and continued to pursue 5181 chars",negative,-0.8026614785194397
american airlines says ai could help with fares but only to save time,american airlines is considering using artificial intelligence to help automate the process of filing millions of daily fares.,https://thepointsguy.com/news/american-airlines-ai-fares/,2025-09-15 12:30:19,The Points Guy,news,"american airlines top executive had strong words this summer about a competitor using artificial intelligence to help set flight prices. now, the airline is looking at ways to use ai itself but said 3252 chars",neutral,0.0
quitting your job this fall might be a bad idea,"a cooling labor market and economic worries could dampen hiring this fall. it doesnt mean you should give up, a recruiter told business insider.",https://www.businessinsider.com/job-seekers-shouldnt-expect-fall-hiring-spike-2025-9,2025-09-16 16:09:19,Business Insider,news,"job seekers listen to logan reed, left, a talent acquisition coordinator for princess cruise line, at a job fair thursday, aug. 28, 2025, in sunrise, florida.marta lavandierassociated press li 4840 chars",neutral,0.0
is rotten tomatoes still reliable? a statistical analysis,can hollywoods stamp of artistic excellence still be trusted?,https://www.statsignificant.com/p/is-rotten-tomatoes-still-reliable,2025-08-21 00:10:07,Statsignificant.com,news,"intro why is everything certified fresh? i stayed in a hotel recently, which means i watched cable television, which means i consumed commercials that i could not skipand some of these commercial 10716 chars",neutral,0.0
