title,description,url,publishedAt,source,type,content,sentiment,sentiment_score
my intrinsic valuation on kulr,"hey there! i am looking to refine and improve my intrinsic valuation analysis. any form of suggestions, criticism or feedback, be it on the format or the model or my thought processes will be apprecia...",https://www.reddit.com/r/KULR/comments/1j37kim/my_intrinsic_valuation_on_kulr/,2025-03-04 10:09:45,Reddit,reddit_post,"hey there! i am looking to refine and improve my intrinsic valuation analysis. any form of suggestions, criticism or feedback, be it on the format or the model or my thought processes will be appreciated! this one would be rather long. this dd or intrinsic valuation will be for my own or for your academic purpose. this is not financial advice. for those who do not know what is kulr, this section will be for you. for those that already know what kulr does, and have an insatiable desire to see an amateurs dcf analysis, you should skip this section. i will be using the 2023 10k latest and the 2024 10q as reference as well as the 2024 summer investors presentation. i will also be including a link to my dcf model below. 1.0 business overview historically, kulr, focused on thermal energy management solutions for space and department of defense applications, with recent expansion into energy storage and vibration reduction markets operating in a technology sector and in an industry for electrical components, kulr specialises in 3 technological domains energy storage systems and recycling thermal management solutions rotary system vibration reduction. kulr currently possesses solutions...",neutral,0.0
"ecommerce industry news recap week of sep 1st, 2025",hi recommerce im paul and i follow the ecommerce industry closely for my shopifreaks ecommerce newsletter. every week for the past 4 years ive posted a summary recap of the weeks top stories ...,https://www.reddit.com/r/ecommerce/comments/1n5yl2u/ecommerce_industry_news_recap_week_of_sep_1st_2025/,2025-09-01 19:41:17,Reddit,reddit_post,"hi recommerce im paul and i follow the ecommerce industry closely for my shopifreaks ecommerce newsletter. every week for the past 4 years ive posted a summary recap of the weeks top stories on this subreddit, which i cover in depth with sources in the full edition. lets dive in to this weeks top ecommerce news... stat of the week 16 of consumers used a digital wallet for their last online retail purchase, twice the rate of use in brickandmortar stores. in physical retail stores, 42 of consumers used debit cards and 38 used credit cards for their last purchase, according to a recent pymnts intelligence report. on friday, the united states ended the nearly century old de minimis exemption, which allowed items worth less than 800 to be shipped to the country duty free. it ended for chinese goods in may, but now the exemption is closed for the rest of the world. the changes were announced via executive order on july 30th, but just took effect on aug 29th. in advance of the official termination date, several european countries, as well as australia, india, japan, south korea, taiwan, thailand, new zealand, and mexico announced suspensions...",neutral,0.0
the big mall short 9 check. your. phone. chapter 1,"gamestopgme relevance in this post the next chapter, i show that advan research other data firms are hoovering our cell phone data and selling it to hedge funds 95 of advans clients are h...",https://www.reddit.com/r/Superstonk/comments/xtyapl/the_big_mall_short_9_check_your_phone_chapter_1/,2022-10-02 20:02:19,Reddit,reddit_post,"gamestopgme relevance in this post the next chapter, i show that advan research other data firms are hoovering our cell phone data and selling it to hedge funds 95 of advans clients are hedge funds. advan selfreports its foot traffic data on a t1 basis the very next day says it is as accurate as 99 to predict future sales hedge funds can use this info to short accordingly. advan currently covers over 3000 tickers i tracked some samples of cmbs loans walmart portfolios with gme stores as part of them showing that advan tracks this mallreal estate data for malls containing gme. advan started offering cmbs officially last year. in chapter 2, i predict that hedge funds of advan and other firms have probably been using our own cell phone data to track cmbsreal estate data and haveare positioning themselves short since last year. x200b x200b tldr companies like cherre provide data to real estate investors and more to help them track their portfolios. these 3rd party connections include companies that can do everything from track railroad noise to offer all permits offered at a specific address. companies like mapped safegraph are among...",neutral,0.0
the ai news that just killed google and most people missed it,"what if the biggest tech disruption in 20 years happened this week and nobody noticed? while everyone was distracted by the usual noise, five companies quietly released ai news thats about to change...",https://www.reddit.com/r/AISEOInsider/comments/1m02hpd/the_ai_news_that_just_killed_google_and_most/,2025-07-14 23:45:09,Reddit,reddit_post,"what if the biggest tech disruption in 20 years happened this week and nobody noticed? while everyone was distracted by the usual noise, five companies quietly released ai news thats about to change everything. we got the first ai operating system that works while you sleep. an ai smarter than phd students in every subject. and a browser that might finally kill google. the insane part? your competition has no idea this ai news even exists. but by the end of this article, youll know exactly how to use these tools to dominate your market while everyone else is still figuring out chatgpt. watch the video tutorial below get a free seo strategy session discount now want to get more customers, make more profit save 100s of hours with ai? join me in the ai profit boardroom want more money, traffic and sales from seo? join the seo elite circle need ai automation services? book an ai discovery session here the ai news thats creating millionaires while others sleep im julian goldie, and ive been in the trenches of ai and seo for years. but this weeks...",neutral,0.0
when to use each ai tool chatgpt vs perplexity vs grok vs gemini 2025 guide,"artificial intelligence tools have rapidly evolved from simple chatbots into powerful assistants that streamline research, writing, coding, customer service, and more. among the most widely used...",https://www.reddit.com/r/NextGenAITool/comments/1nb1y0f/when_to_use_each_ai_tool_chatgpt_vs_perplexity_vs/,2025-09-07 19:11:28,Reddit,reddit_post,"artificial intelligence tools have rapidly evolved from simple chatbots into powerful assistants that streamline research, writing, coding, customer service, and more. among the most widely used ai platforms in 2025 are chatgpt openai, perplexity, grok by xaielon musk, and gemini google. each tool has unique strengths, and choosing the right one depends on your workflow, industry needs, and desired outcomes. in this guide, well explore when to use each ai tool, based on their core use cases and advantages. 1. when to use chatgpt chatgpt is one of the most versatile ai platforms, making it a goto choice for individuals and businesses. best uses for chatgpt content creation blog posts, articles, marketing copy, and social media posts. education tutoring explaining complex topics, personalized learning, and study guides. coding assistance debugging, code explanations, and generating scripts. customer support building custom chatbots and automating responses. brainstorming creative writing, idea generation, and innovation support. workflow automation through thirdparty integrations like zapier, notion, and slack. choose chatgpt if you need flexibility across multiple industries and tasks. 2. when to use perplexity ai perplexity ai positions itself as the google alternative for aipowered research. it blends...",neutral,0.0
"this weeks top ecommerce news stories sep 1st, 2025","hi rshopify im paul and i follow the ecommerce industry closely for my shopifreaks ecommerce newsletter, which ive published weekly since 2021. i was invited by the mods of this subreddit to s...",https://www.reddit.com/r/shopify/comments/1n5yqv8/this_weeks_top_ecommerce_news_stories_sep_1st_2025/,2025-09-01 19:47:41,Reddit,reddit_post,"hi rshopify im paul and i follow the ecommerce industry closely for my shopifreaks ecommerce newsletter, which ive published weekly since 2021. i was invited by the mods of this subreddit to share my weekly ecommerce news recaps ie shorter versions of my full editions to rshopify. although my news recaps arent strictly about shopify some weeks shopify is covered more than others, i hope they bring value to your business no matter what platform youre on. lets dive into this weeks top stories... stat of the week 16 of consumers used a digital wallet for their last online retail purchase, twice the rate of use in brickandmortar stores. in physical retail stores, 42 of consumers used debit cards and 38 used credit cards for their last purchase, according to a recent pymnts intelligence report. on friday, the united states ended the nearly century old de minimis exemption, which allowed items worth less than 800 to be shipped to the country duty free. it ended for chinese goods in may, but now the exemption is closed for the rest of the world. the changes were announced via executive order on july 30th, but just took effect on...",neutral,0.0
search engine optimisation services proven strategies for longterm organic growth,"business success hinges on visibility, and in the modern digital marketing world, i...",https://www.reddit.com/r/WhiteLabelSEOServices/comments/1n2bfnj/search_engine_optimisation_services_proven/,2025-08-28 12:53:31,Reddit,reddit_post,"business success hinges on visibility, and in the modern digital marketing world, it is search engine marketing that grants it. over 90 of digital journeys kick off with a search engine, and that makes optimisation a musthave. for businesses that want to win the race between organic search and paid search, investing in search engine marketing is the best choice. seo and sem are the two main types of search engine marketing, and unlike seo, which is bound to sterling growth, paid search is subject to the whims of marketing budgets. professional seo agencies do not operate in silos with only technical expertise. the best seo agencies combine technical expertise with content marketing, strategic planning, and brand building to create magnificent online presences for businesses. exceptional agencies move away from rankfocused thinking. they develop a coherent approach to achieving the organizations goals. this is why, with leading seo agencies on board, a business moves from having an idle website to building a strong digital brand. why search engine optimisation services are vital in 2025 recent studies reveal that more than 75 of people never move past the first page of google. users that do not get their required...",neutral,0.0
18 ai skills to master in 2025 stay ahead in the future of work,"artificial intelligence ai is no longer a futuristic conceptits todays most powerful tool for businesses, creators, and professionals. as we move deeper into 2025, mastering ai skills is be...",https://www.reddit.com/r/NextGenAITool/comments/1n8qt2b/18_ai_skills_to_master_in_2025_stay_ahead_in_the/,2025-09-05 00:22:19,Reddit,reddit_post,"artificial intelligence ai is no longer a futuristic conceptits todays most powerful tool for businesses, creators, and professionals. as we move deeper into 2025, mastering ai skills is becoming essential to stay competitive in the workplace. whether youre in marketing, design, development, or sales, ai can help you work faster, smarter, and more efficiently. in this article, well explore the 18 most valuable ai skills to master in 2025 and how you can leverage them to futureproof your career. 1. ai generalist an ai generalist is someone who understands how to use multiple ai tools across different business functions. from automating workflows with zapier and make to leveraging chatgpt for research and content, ai generalists can help startups and companies streamline operations. this is the musthave skill for every earlystage employee. 2. ai content writing with ai writing tools like chatgpt and jasper, you can create highquality content at scale. businesses are looking for writers who can combine creativity with aidriven efficiency to produce blog posts, articles, and marketing copy that ranks well on search engines and resonates with readers. 3. ai graphic design aipowered design tools such as canva, figma, midjourney, recraft, and ideogram make it easier than...",neutral,0.0
top 7 ai web scraping tools complete review and analysis,top 7 ai web scraping tools complete review and analysis data extraction has t...,https://www.reddit.com/r/u_softtechhubus/comments/1nfv2vb/top_7_ai_web_scraping_tools_complete_review_and/,2025-09-13 11:26:15,Reddit,reddit_post,"top 7 ai web scraping tools complete review and analysis data extraction has transformed dramatically with artificial intelligence reshaping how businesses collect web information. traditional scraping methods required extensive coding knowledge and constant maintenance to combat antibot systems. modern aipowered tools have changed this landscape entirely, offering intelligent solutions that adapt to website changes and deliver clean, structured data with minimal setup. the demand for web scraping has exploded across industries. financial firms monitor market data continuously, researchers gather information for studies, and businesses track competitor pricing. ecommerce companies need product details, journalists verify facts across multiple sources, and marketing teams collect social media insights. each use case benefits from ai capabilities that understand content context rather than just following rigid patterns. why ai web scraping tools matter web scraping complexity has grown alongside website sophistication. modern sites use dynamic javascript frameworks, implement captcha systems, and deploy advanced bot detection mechanisms. ai tools address these challenges by mimicking human behavior patterns, adapting to changing page structures, and extracting meaningful data rather than raw html. speed represents another critical advantage. manual data collection takes hours or days for large datasets. ai scrapers process thousands of pages simultaneously while maintaining accuracy....",neutral,0.0
ai daily news rundown microsoft and openai announce the next phase of their partnership ai classroom use jumps sixfold in two years more september 12 2025 your daily briefing on the real world business impact of ai,"ai daily rundown september 12th, 2025 hello ai unraveled listeners, and welcom...",https://www.reddit.com/r/u_enoumen/comments/1nfiahn/ai_daily_news_rundown_microsoft_and_openai/,2025-09-12 23:28:42,Reddit,reddit_post,"ai daily rundown september 12th, 2025 hello ai unraveled listeners, and welcome to todays news where we cut through the hype to find the realworld business impact of ai. todays headlines microsoft and openai announce the next phase of their partnership ai classroom use jumps sixfold in two years albania appoints worlds first aigenerated minister us regulator probes ai chatbots over child safety concerns fda approves apple watch hypertension alert feature microsoft avoids eu fine by unbundling teams openais 300b oracle deal highlights ais scaling challenge ftc investigates chatbots impact on kids and teens ai classroom use jumps sixfold in two years startup produces 3,000 ai podcasts weekly ai training learn anything with notebooklm chatgpt ai solves math proof that stumped humans for months listen at detailed newsletter summary unlock enterprise trust partner with ai unraveled ai is at the heart of how businesses work, build, and grow. but with so much noise in the industry, how does your brand get seen as a genuine leader, not just another vendor? thats where we come in. the...",neutral,0.0
top genai startups in finance 2025,startup namebusiness description alphasense is a market intelligence and search platform that uses aidriven technology to help professionals mak...,https://www.reddit.com/r/private_equity/comments/1k5npte/top_genai_startups_in_finance_2025/,2025-04-23 01:53:11,Reddit,reddit_post,"startup namebusiness description alphasense is a market intelligence and search platform that uses aidriven technology to help professionals make better business decisions. it provides access to a vast range of content including company filings, expert interviews, news, and regulatory documents, enabling users to gain comprehensive insights into market trends and industry developments. chronograph provides cloudbased analytics and data management solutions for private equity investors. the platform offers performance analytics, reporting, data management, esg solutions, and api connectivity for both limited partners and general partners. planful offers a financial performance management platform that transforms the way businesses plan, close, and report their financials. the platform leverages ai to provide realtime insights, improve forecasting accuracy, and enhance collaboration across teams. bamsec transforms how financial professionals work with sec filings and earnings transcripts by providing tools to streamline research and save time. the financial data platform offers features such as document search, historical data retrieval, collaboration tools, and intelligent organization to enhance productivity and efficiency. macro offers an ai workspace where users can chat and collaborate with ai, edit pdfs, documents, notes, code, and diagrams in one place. the platform provides builtin editors for code, word, notes, and pdf, along with access...",neutral,0.0
llm seeding the new strategy for ai visibility thats changing how brands get found,llm seeding the new strategy for ai visibility thats changing how brands get found,https://www.reddit.com/r/u_softtechhubus/comments/1nfteme/llm_seeding_the_new_strategy_for_ai_visibility/,2025-09-13 09:44:18,Reddit,reddit_post,"llm seeding the new strategy for ai visibility thats changing how brands get found imagune someone asks chatgpt about the best project management tools for remote teams. your brand pops up in the response, complete with a detailed mention of why your solution stands out. the catch? you dont even rank on googles first page for that keyword. welcome to the world of llm seeding, where traditional ranking rules get turned upside down. ai tools like chatgpt, claude, gemini, and perplexity are reshaping how people find answers. instead of scrolling through ten blue links, users get instant, synthesized responses that pull from multiple sources across the web. these aigenerated answers often bypass traditional search results entirely. this shift creates both a challenge and an opportunity. if your content isnt optimized for ai visibility, youre missing out on a rapidly growing audience. but if you master llm seeding, you can get your brand mentioned and cited even without top search rankings. what llm seeding actually means llm seeding represents a fundamental shift in content strategy. rather than focusing solely on search engine rankings, youre optimizing for ai visibility and citations. the concept centers around publishing content in formats and locations...",neutral,0.0
your 2025 budget is already obsolete. heres how to fix it.,"beyond the spreadsheet 12 emerging trends in small business budgeting for 2025 as a small business owner, youre no stranger to wearing multiple hats. youre the ceo, the head of marketing, the le...",https://www.reddit.com/r/GrowCashflow/comments/1n0clwd/your_2025_budget_is_already_obsolete_heres_how_to/,2025-08-26 04:37:35,Reddit,reddit_post,"beyond the spreadsheet 12 emerging trends in small business budgeting for 2025 as a small business owner, youre no stranger to wearing multiple hats. youre the ceo, the head of marketing, the lead salesperson, and often, the chief financial officer. juggling all these roles is a monumental task, and its easy to let some things slide. but if theres one thing you cant afford to neglect, its your budgeting. for too long, small business budgeting has been a onceayear, setitandforgetit affair. a frantic scramble at the end of the year to pull together a spreadsheet that, more often than not, ends up gathering dust in a digital folder. but the business world of 2025 is a different beast altogether. its faster, more unpredictable, and more competitive than ever before. and in this new landscape, a static, outdated budget is a recipe for disaster. the good news? a new era of financial planning and analysis is dawning for small businesses. fueled by technology and a new way of thinking, budgeting is transforming from a dreaded chore into a powerful tool for driving small business growth. its becoming more dynamic, more intelligent, and more forwardlooking than ever before. so, grab a...",neutral,0.0
build an aipowered research assistant with linear scrapeless claude,"modern teams need instant access to reliable data for informed decisionmaking. whether youre researching competitors, analyzing trends, or gathering market intelligence, manual data collection slows...",https://www.reddit.com/r/Scrapeless/comments/1n7ap4e/build_an_aipowered_research_assistant_with_linear/,2025-09-03 10:02:11,Reddit,reddit_post,"modern teams need instant access to reliable data for informed decisionmaking. whether youre researching competitors, analyzing trends, or gathering market intelligence, manual data collection slows down your workflow and breaks your development momentum. by combining linears project management platform with scrapelesss powerful data extraction apis and claude ais analytical capabilities, you can create an intelligent research assistant that responds to simple commands directly in your linear issues. this integration transforms your linear workspace into a smart command center where typing search competitor analysis or trends ai market automatically triggers comprehensive data gathering and aipowered analysisall delivered back as structured comments in your linear issues. complete workflow overview why choose linear scrapeless claude? linear the modern development workspace linear provides the perfect interface for team collaboration and task management issuedriven workflow natural integration with development processes realtime updates instant notifications and synchronized team communication webhooks api powerful automation capabilities with external tools project tracking builtin analytics and progress monitoring team collaboration seamless commenting and discussion features scrapeless enterprisegrade data extraction scrapeless delivers reliable, scalable data extraction across multiple sources google search enables comprehensive extraction of google serp data across...",neutral,0.0
"whats new in ecommerce? week of sep 1st, 2025",hi rshopifyecommerce im paul and i follow the ecommerce industry closely for my shopifreaks ecommerce newsletter. every week for the past 4 years ive posted a summary recap of the weeks top st...,https://www.reddit.com/r/ShopifyeCommerce/comments/1n5yne3/whats_new_in_ecommerce_week_of_sep_1st_2025/,2025-09-01 19:43:47,Reddit,reddit_post,"hi rshopifyecommerce im paul and i follow the ecommerce industry closely for my shopifreaks ecommerce newsletter. every week for the past 4 years ive posted a summary recap of the weeks top stories on this subreddit, which i cover in depth with sources in the full edition. lets dive in to this weeks top ecommerce news... stat of the week 16 of consumers used a digital wallet for their last online retail purchase, twice the rate of use in brickandmortar stores. in physical retail stores, 42 of consumers used debit cards and 38 used credit cards for their last purchase, according to a recent pymnts intelligence report. on friday, the united states ended the nearly century old de minimis exemption, which allowed items worth less than 800 to be shipped to the country duty free. it ended for chinese goods in may, but now the exemption is closed for the rest of the world. the changes were announced via executive order on july 30th, but just took effect on aug 29th. in advance of the official termination date, several european countries, as well as australia, india, japan, south korea, taiwan, thailand, new zealand, and mexico announced suspensions...",neutral,0.0
